,index,crawl_date,domain,url,mime_type_web_server,mime_type_tika,language,content,polarity,subjectivity,polarity_type,subjectivity_type
134005,157452,20200724,211ontario.ca,https://211ontario.ca/,text/html,text/html,en,"Ontario 211 | Community and Social Services Help Line Call 2-1-1 Email 2-1-1 Live Chat Topics Overview Abuse / Assault Community Programs Disabilities Emergency / Crisis Employment / Training Family services Food Francophones Government / Legal Health Care Homelessness Housing Income Support Indigenous Peoples Homelessness Housing Income Support Indigenous Peoples LGBTQ+ Mental Health / Addictions Newcomers Older Adults Youth Working With 211 Overview Looking for Help Community Agencies Emergency Management Embed 211 Search Resources Order 211 Promotional Materials Suggest A New Listing Partners Blog Overview Community & Social Services Financial Assistance Government Services Health and Mental Health Help Starts Here Newcomers Older Adults Regional Snapshots Volunteering & Fundraising 211 Data About Overview Our Mandate History & Launch Dates Board of Directors Annual Reports News Privacy & Complaints Policy Contributors Contact FR 211 Ontario Services Blog About Chat with 211 Contact 211 Ontario Contact 211 with Service Updates Edit Listing Entity Single Home How Can I Help New Listing Page not found Search Search Services and Organizations Tell 211 about Changes in Services Topics Working With 211 Partners Find programs and services in your community. Navigate the network of human services quickly and easily. FOR INFORMATION REGARDING COVID-19 SERVICES AND SUPPORT PLEASE CLICK HERE. Try the Search Help Tool Show Options Search Topics Abuse / Assault Overview Child abuse services Counselling for abused people Crisis lines for abused people Sexual assault support Shelter for abused women Victims of abuse support programs Community Programs Overview Community / Recreation centres Community information Computer access General Public libraries Volunteer centres Disabilities Overview Assistive devices Developmental disabilities Disabilities employment programs Disability associations Home repairs Learning disabilities Ontario Disability Support Program Parking permits for people with disabilities Physical disabilities Sport for people with disabilities Transportation for people with disabilities Emergency / Crisis Overview Crisis lines Elder abuse Hospital emergency / Urgent care In-person crisis services Shelters from abuse Victims of crime support programs Employment / Training Overview Academic upgrading Adult literacy Apprenticeship Career counselling Disabilities employment programs Employer staffing assistance International credentials Internationally trained professionals Job search support / training Newcomer employment programs Occupational health and safety Self-employment / Entrepreneurship Summer employment Work experience Youth employment Family services Overview Baby items Camps Child abuse services Child care Parent / Child programs Pregnancy / Postnatal Food Overview Cooking classes and facilities Food access for seniors/people with disabilities Food banks and referrals Food delivery Food for special dietary needs Free / Low-cost meals Grocery stores, fresh food and producers Grow / Pick your own food Infant formula / Baby food Non-profit catering services and eating establishments Other food security initiatives School meal programs Francophones Overview Francophones Government / Legal Overview Community legal clinics Community legal services Consumer protection / Complaints Elected officials Human rights ID (identification) Legal information Health Care Overview Community health centres Finding a medical professional Home support programs Hospice / palliative care Hospital emergency / Urgent care Hospitals Local Health Integration Networks Long term care homes Pregnancy / Postnatal Transportation to medical appointments Walk-in medical clinics Homelessness Overview Free / Low cost meals Homeless respite Homeless shelters Street outreach Housing Overview Health related temporary housing Help to find housing Home improvement / renovation / accessibility Home ownership Housing expense assistance Other housing related services / organizations Rental housing Retirement homes Supportive (semi-independent) housing Transitional housing Income Support Overview Emergency financial assistance Employment Insurance (EI) Income programs for older adults Social Assistance Workers compensation Indigenous Peoples Overview Indigenous Peoples Homelessness Overview Free / Low cost meals Homeless respite Homeless shelters Street outreach Housing Overview Health related temporary housing Help to find housing Home improvement / renovation / accessibility Home ownership Housing expense assistance Other housing related services / organizations Rental housing Retirement homes Supportive (semi-independent) housing Transitional housing Income Support Overview Emergency financial assistance Employment Insurance (EI) Income programs for older adults Social Assistance Workers compensation Indigenous Peoples Overview Indigenous Peoples LGBTQ+ Overview LGBTQ+ Mental Health / Addictions Overview Addiction counselling Addiction treatment Community mental health centres Crisis lines Geriatric psychiatry In-person crisis services Justice and mental health programs Psychiatric hospitals Support groups Newcomers Overview Consulates / Embassies English as a second language French as a second language Immigration / Sponsorship International credentials Internationally-trained professionals Interpretation / Translation Newcomer employment programs Refugees Settlement services Older Adults Overview Elder abuse Geriatric psychiatry Housing for seniors Income programs for older adults Long term care homes Retirement homes Transportation for older adults Youth Overview Shelters for youth Summer employment Young parents Youth Drop-In Centres Youth employment BlogView All Community Connection, Collingwood: Nonprofit Board Call for Candidates New Board Members are sought for Community Connection, located in Collingwood. Deadline: September 1, 2020 Our dynamic and complex org...Volunteering & Fundraising Ample Labs looks to build covid information chatbot to support information needs for Toronto’s homeless Last week the province released their modeling for the spread of COVID-19 and it’s not easy to look at. Ontarians are trying to do t...Community & Social Services 211 Ambassador Social Media Toolbox During Pandemic 211 Ontario is asking 211 Ambassadors to help share the message that the 211 helpline is to help Ontario residents find the right help in...Community & Social Services VideosView all on YouTube 211: Make the Right Call with 911 Emergency Help (No 311 Municipal Hotline) 211- Helping Healthcare Providers Connect People to the Services they Need How 211 Helps Ontario Communities Sign Up for Our Newsletter Enter Name Enter email address Need Help? Free Confidential Live Answer 24/7 Call 2-1-1 Toll Free 1-877-330-3213 Try our Virtual Assistant Sitemap Topics Abuse / Assault Community Programs Disabilities Emergency / Crisis Employment / Training Family services Food Francophones Government / Legal Health Care Homelessness Housing Income Support Indigenous Peoples Homelessness Housing Income Support Indigenous Peoples LGBTQ+ Mental Health / Addictions Newcomers Older Adults Youth Working With 211 Overview Embed 211 Search Looking for Help Community Agencies Emergency Management 211 Ambassadors Resources Search Resources Search Order 211 Promotional Materials Suggest a New Listing Partners Blog Community & Social Services Financial Assistance Health and Mental Health Help Starts Here Newcomers Older Adults Older Adults Volunteering & Fundraising Regional Snapshots Government Services About Overview Our Mandate History & Launch Dates Board of Directors Annual Reports News Annual Reports News Privacy & Complaints Policy Contributors Search Site 211 is a helpline and online database of Ontario's community and social services. 211 is answered and updated by highly-trained specialists. All Rights Reserved © Copyright 2020 Ontario. Website designed by Evoke Solutions.",0.09319345529022952,0.3029732811990874,Positive,Objective
134146,157600,20200724,211ontario.ca,https://211ontario.ca/fr/,text/html,text/html,fr,"Ligne d'aide en matière de services sociaux et communautaires TÉLÉPHONE 2-1-1 COURRIEL 2-1-1 CLAVARDAGE Sujets Aperçu Alimentation Autochtones Aînés Emploi / Formation Francophones Gouvernement / Juridique Handicaps Jeunesse LGBTQ+ Logement Nouveaux arrivants Programmes communautaires Sansabrisme Santé mentale / Dépendances Nouveaux arrivants Programmes communautaires Sansabrisme Santé mentale / Dépendances Services à la famille Soins de santé Soutien du revenu Urgences / Crises Violence / Agression Collaborer avec le 211 Aperçu Vous cherchez de l’aide? Agences communautaires Gestion des urgences Recherche 211 intégrée Ressources Commandez du matériel promotionnel 211 Nouveau Dossier Partenaires Blogue Aperçu Aide financière Aînés Bénévolat et collecte de fonds Instantanés régionaux L’aide, ça commence ici! Nouveaux arrivants Programmes gouvernementaux Santé et santé mentale Services sociaux et communautaires Les données du 211 À notre sujet Aperçu Notre mandat Une brève histoire du 211 en Ontario Conseil d’administration Rapports annuels Nouvelles Conditions d’utilisation et confidentialité Collaborateurs Nous rejoindre EN 211 Ontario Services Blogue À notre sujet Accueil Aperçu des sujets Clavardez avec le 211 Collaborer avec le 211 Contacter 211 pour une actualisation de vos services Entité unique Essayez notre outil d’aide à la recherche Joindre 211 Ontario Modifier l’inscription Nouveau Dossier Page non trouvée Search Services et organisations de recherche Sujets Partenaires Trouvez des programmes et des services en Ontario. Naviguez le réseau des services sociaux de votre communauté. Pour obtenir des renseignements sur les services et le soutien offerts dans le cadre de la COVID-19, cliquez ici ESSAYEZ NOTRE OUTIL D’AIDE À LA RECHERCHE AFFICHEZ LES OPTIONS Recherche Sujets Alimentation Aperçu Accès alimentaires pour les aînés / personnes handicapées Autres initiatives en sécurité alimentaire Banques alimentaires et aiguillage Cours de cuisine et cuisines communautaires Cultiver / Récolter ses produits alimentaires Épiceries, produits frais et producteurs Livraison d'aliments Préparation / Nourriture pour nourrissons Repas gratuits ou à bas prix Repas pour enfants Services de restauration et de traiteur sans but lucratif Autochtones Aperçu Autochtones Aînés Aperçu Établissements de soins de longue durée Logement pour personnes âgées Maisons de retraite Maltraitance des aînés Programmes du revenu pour les personnes âgées Psychiatrie gériatrique Transport pour les personnes âgées Emploi / Formation Aperçu Aide au recrutement Alphabétisation des adultes Apprentissage Diplômes internationaux Emploi d'été Emploi des jeunes Expérience de travail Orientation professionnelle Professionnels formés à l'étranger Programmes d'emploi pour nouveaux arrivants Programmes d’emploi pour les personnes ayant un handicap Rattrapage scolaire Santé et sécurité au travail Soutien et formation à la recherche d'emploi Travail indépendant / Entrepreneuriat Francophones Aperçu Francophones Gouvernement / Juridique Aperçu Cliniques juridiques communautaires Droits de la personne Pièces d'identité Protection / Plaintes du consommateur Renseignements juridiques Représentants élus Services juridiques communautaires Handicaps Aperçu Appareils et accessoires fonctionnels Associations de personnes ayant un handicap Programme ontarien de soutien aux personnes handicapées Programmes d’emploi pour les personnes ayant un handicap Rénovations domiciliaires Services pour déficience intellectuelle Services pour déficience physique Sport pour les personnes handicapées Stationnement pour les personnes ayant un handicap Transport pour les personnes ayant un handicap Troubles d'apprentissage Jeunesse Aperçu Centre de liaison pour les jeunes Emploi d'été Emploi des jeunes Jeunes parents Refuges pour jeunes LGBTQ+ Aperçu LGBTQ+ Logement Aperçu Accès à la propriété Aide aux dépenses de logement Aide pour trouver un logement Amélioration / Rénovation / Accessibilité domiciliaire Autres services / organismes relatifs au logement Logement avec service de soutien (semi-autonome) Logement locatif Logement transitionnel Logements temporaires pour raison de santé Maisons de retraite Nouveaux arrivants Aperçu Anglais langue seconde Consulats / Ambassades Diplômes internationaux Français langue seconde Immigration / Parrainage Interprétation / Traduction Professionnels formés à l'étranger Programmes d'emploi pour nouveaux arrivants Réfugiés Services d'établissement Programmes communautaires Aperçu Accès à des ordinateurs Bibliothèques publiques Centres communautaires et de loisirs Centres de bénévolat Général Information communautaire Sansabrisme Aperçu Refuges pour les sans-abri Repas gratuits ou à bas prix Répit pour les sans-abri Services d'approche dans la rue Santé mentale / Dépendances Aperçu Centres communautaires de santé mentale Counseling en matière de dépendance Groupes de soutien Hôpitaux psychiatriques Lignes de crise Programmes de justice et de santé mentale Psychiatrie gériatrique Traitement de la dépendance Nouveaux arrivants Aperçu Anglais langue seconde Consulats / Ambassades Diplômes internationaux Français langue seconde Immigration / Parrainage Interprétation / Traduction Professionnels formés à l'étranger Programmes d'emploi pour nouveaux arrivants Réfugiés Services d'établissement Programmes communautaires Aperçu Accès à des ordinateurs Bibliothèques publiques Centres communautaires et de loisirs Centres de bénévolat Général Information communautaire Sansabrisme Aperçu Refuges pour les sans-abri Repas gratuits ou à bas prix Répit pour les sans-abri Services d'approche dans la rue Santé mentale / Dépendances Aperçu Centres communautaires de santé mentale Counseling en matière de dépendance Groupes de soutien Hôpitaux psychiatriques Lignes de crise Programmes de justice et de santé mentale Psychiatrie gériatrique Traitement de la dépendance Services à la famille Aperçu Articles pour bébés Camps Garde d'enfants Grossesse / Après la naissance Maltraitance des enfants Programmes pour parents / enfants Soins de santé Aperçu Centres de santé communautaire Cliniques médicales sans rendez-vous Établissements de soins de longue durée Grossesse / Après la naissance Hôpitaux Réseaux locaux d'intégration des services de santé Soins d'hospice / palliatifs Soutien à domicile Transport aux rendez-vous médicaux Trouver un professionnel de la santé Urgences hospitalières / Soins d'urgence Soutien du revenu Aperçu Aide financière urgente Aide sociale Assurance-emploi (AE) Indemnisation des travailleurs Programmes de soutien du revenu pour aînés Urgences / Crises Aperçu Lignes de crise Maltraitance des aînés Programmes de soutien des victimes de crime Refuges en cas de maltraitance Services de crise en personne Urgences hospitalières / Soins d'urgence Violence / Agression Aperçu Counseling pour victimes de violence Lignes de crise pour les victimes de violence Maltraitance des enfants Programmes de soutien pour les victimes d’actes criminels Refuges pour femmes victimes de violence Soutien en cas d'agression sexuelle BlogueAffichez tout Trousse des médias sociaux pour les ambassadeurs du 211 durant la pandémie de COVID-19 Le 211 Ontario demande aux ambassadeurs du 211 de communiquer ce message : la ligne d’assistance 211 vise à aider les résidents de l...Services sociaux et communautaires Sources d’information Covid-19 pour les résidents de l’Ontario Ministère de la Santé de l’Ontario et information sur la réponse du gouvernement de l’Ontario. https://www.ontario.ca/fr/page/n...Santé et santé mentale Journée 211 2020 – Trousse des ambassadeurs du 211 Bilan de la Journée 211 Le 11 février est la Journée 211 en Amérique du Nord – une journée de sensibilisation collective du se...Services sociaux et communautaires VidéosAffichez toutes les vidéos sur YouTube 211 : Composez le bon numéro : ligne d’urgence 911 (info ligne municipale 311 non incluse) Le 211 aide les professionnels de la santé à relier les patients aux services dont ils ont besoin Comment le 211 aide-t-il les communatés de l’Ontario? Inscrivez-vous à notre bulletin Entrez un nom Entrez une adresse de courriel Besoin d’aide? Gratuit Confidentiel Réponse en direct 24/7 Composez 2-1-1 Sans frais 1-877-330-3213 Essayez notre outil d’aide à la recherche Plan du site Sujets Alimentation Autochtones Aînés Emploi / Formation Francophones Gouvernement / Juridique Handicaps Jeunesse LGBTQ+ Logement Nouveaux arrivants Programmes communautaires Sansabrisme Santé mentale / Dépendances Nouveaux arrivants Programmes communautaires Sansabrisme Santé mentale / Dépendances Services à la famille Soins de santé Soutien du revenu Urgences / Crises Violence / Agression Collaborer avec le 211 Aperçu Vous cherchez de l’aide? Agences communautaires Gestion des urgences Ressources Commandez du matériel promotionnel 211 Commandez du matériel promotionnel 211 Recherche 211 intégrée Partenaires Nouveau Dossier Blogue Aide financière Aînés Bénévolat et collecte de fonds Nouveaux arrivants Santé et santé mentale Services sociaux et communautaires Programmes gouvernementaux Instantanés régionaux Services sociaux et communautaires Programmes gouvernementaux Instantanés régionaux L’aide, ça commence ici! Témoignages d’appelants au 211 À notre sujet Aperçu Notre mandat Une brève histoire du 211 en Ontario Conseil d’administration Rapports annuels Nouvelles Rapports annuels Nouvelles Conditions d’utilisation et confidentialité Collaborateurs Recherche en ligne Le 211 est une ligne d’aide et un répertoire en ligne des services communautaires et sociaux de l’Ontario. Le service 211 est assuré par un personnel hautement qualifié, tant au téléphone qu’à la base de données. Tous droits réservés. © Copyright 2020 Ontario. Le site Internet du Ontario 211 a été conçu par Evoke Solutions.",-0.10000000000000002,0.7999999999999999,Negative,Subjective
