,index,crawl_date,domain,url,mime_type_web_server,mime_type_tika,language,content,polarity,subjectivity,polarity_type,subjectivity_type
6424,6552,20200417,memberservices.membee.com,https://memberservices.membee.com/feeds/Login/CookieFailed.aspx,text/html,application/xhtml+xml,en,Cookies Failed  You have set your browser to not allow third party cookies. Click here to learn more,0.0,0.26666666666666666,Neutral,Objective
7734,7875,20200418,memberservices.membee.com,https://memberservices.membee.com/feeds/directory/directory/action/Alpha/value/All/listingType/A/cid/1185/id/1002901,text/html,application/xhtml+xml,en,"All Listings ( 2721 ) | Greater Niagara Chamber of Commerce Directory  View Listings: ▼ By Category ▼ Alphabetically My Contact List Print List Print my contact list Print Remove All Search ▼ Advanced Search Only PeopleOnly CompaniesAll Legend: Description Available - Additional Images Available - Map Available - All Listings ( 2721 ) 1 2 3 4 5 6 7 8 9 10 11 12 13 14 15 Next > A - Z Z - A 13th Street Winery Phone: (905) 984-8463 Fax: (905) 988-1384 Email: info@13thstreetwinery.com 13th Street Winery evolved from the desire to create exceptional wines that reflect the unique terroir of Niagara while alsoproviding a View Full Listing Similar Listings: Winery / Wineries Contact Listing Owner Please fill in this form to send a message by email to the owner of the listing for 13th Street Winery First Name * Last Name Email * Invalid Email Message Subject * Message *   I understand this service is for personalized messages only and may not be used to send unsolicited broadcast messages to listing owners. Send Message 1729679 Ontario Ltd. O/A Valet Car Wash Phone: (905) 682-2277 Fax: (905) 682-2276 Email: valetcarwash@hotmail.com At St. Catherines Valet Car Wash our Mission isTo be the first choice for vehicle cleaning, appearance and maintenance needs in St. View Full Listing Similar Listings: Car Wash/Gas Bar Contact Listing Owner Please fill in this form to send a message by email to the owner of the listing for 1729679 Ontario Ltd. O/A Valet Car Wash First Name * Last Name Email * Invalid Email Message Subject * Message *   I understand this service is for personalized messages only and may not be used to send unsolicited broadcast messages to listing owners. Send Message 180 Marketing Phone: (905) 687-3371 Fax: (905) 687-9224 Email: luc@do180.com 180 Marketing is a full service agency dedicated to achieving our customers marketing objectives using all forms of media. With a View Full Listing Similar Listings: Marketing - Advertising/Branding/Communications Contact Listing Owner Please fill in this form to send a message by email to the owner of the listing for 180 Marketing First Name * Last Name Email * Invalid Email Message Subject * Message *   I understand this service is for personalized messages only and may not be used to send unsolicited broadcast messages to listing owners. Send Message 20/20 Insurance Brokers Ltd Phone: (905) 984-8694 Email: morgan@2020insurance.ca View Full Listing Similar Listings: Insurance - Broker/Financial Services Contact Listing Owner Please fill in this form to send a message by email to the owner of the listing for 20/20 Insurance Brokers Ltd First Name * Last Name Email * Invalid Email Message Subject * Message *   I understand this service is for personalized messages only and may not be used to send unsolicited broadcast messages to listing owners. Send Message 2021 Canada Games Host Society, Inc. Phone: (905) 321-5979 Email: vittoria@luvvittsolutions.com POWERING UP | NIAGARA 2021The 2021 Canada Games Host Society is the steward tasked with hosting the 28th edition of the Canada Games. To be View Full Listing Similar Listings: Special Events Contact Listing Owner Please fill in this form to send a message by email to the owner of the listing for 2021 Canada Games Host Society, Inc. First Name * Last Name Email * Invalid Email Message Subject * Message *   I understand this service is for personalized messages only and may not be used to send unsolicited broadcast messages to listing owners. Send Message 88 Co. / Brock Office Automation Phone: (905) 984-8266 Email: mgammon@BrockOA.com Business process innovations and improvement consultations. Solutions available from Dahle, Destroyit, Epson/Seiko, Francotyp Postalia, View Full Listing Similar Listings: Professional Services - Business Contact Listing Owner Please fill in this form to send a message by email to the owner of the listing for 88 Co. / Brock Office Automation First Name * Last Name Email * Invalid Email Message Subject * Message *   I understand this service is for personalized messages only and may not be used to send unsolicited broadcast messages to listing owners. Send Message A & M Electric Phone: (905) 468-3834 Email: Angelo@amelectric.ca A & M Electric (A&M Electric) installs and maintains electrical systems in residential, commercial,industrial and institutional View Full Listing Similar Listings: Electrical Contractors Contact Listing Owner Please fill in this form to send a message by email to the owner of the listing for A & M Electric First Name * Last Name Email * Invalid Email Message Subject * Message *   I understand this service is for personalized messages only and may not be used to send unsolicited broadcast messages to listing owners. Send Message A Third Space Pottery Studio Phone: (289) 501-1967 Email: vchartmann@yahoo.ca A Third Space is a warm, bright studio located near the skyway in St. Catharines, Ontario. It is the perfect spot to relax, learn and enjoy View Full Listing Similar Listings: Pottery, Ceramics, Pottery Studios Contact Listing Owner Please fill in this form to send a message by email to the owner of the listing for A Third Space Pottery Studio First Name * Last Name Email * Invalid Email Message Subject * Message *   I understand this service is for personalized messages only and may not be used to send unsolicited broadcast messages to listing owners. Send Message A.S. Security & Surveillance Inc Phone: (289) 568-0660 Email: questions@assecurity.ca A.S. Security & Surveillance Inc is a licenced, insured and WSIB certified Niagara and Hamilton Region based security company View Full Listing Similar Listings: Security Chamber members can get a 5% discount on any new commercial installation from A.S. Security & Surveillance! Contact Rob or Anthony at 289-568-0660 today! Contact Listing Owner Please fill in this form to send a message by email to the owner of the listing for A.S. Security & Surveillance Inc First Name * Last Name Email * Invalid Email Message Subject * Message *   I understand this service is for personalized messages only and may not be used to send unsolicited broadcast messages to listing owners. Send Message A-1 Flooring Canada Phone: (905) 688-9200 Toll Free: (800) 375-9901 Fax: (905) 689-9989 Email: scheduling@a1flooring.com Sales and installation of hardwood, ceramic, vinyl, laminate, and carpet. Retail and commercial. View Full Listing Similar Listings: Retail - Floor Coverings/Treatments Contact Listing Owner Please fill in this form to send a message by email to the owner of the listing for A-1 Flooring Canada First Name * Last Name Email * Invalid Email Message Subject * Message *   I understand this service is for personalized messages only and may not be used to send unsolicited broadcast messages to listing owners. Send Message 1 2 3 4 5 6 7 8 9 10 11 12 13 14 15 Next > A - Z Z - A Directory Sitemap New Members Special Offers Membee | Join The Hive",0.014926046176046183,0.5061908770242104,Positive,Subjective
51112,62757,20200530,memberservices.membee.com,https://memberservices.membee.com/feeds/directory/directory/action/Alpha/value/All/listingType/A/cid/1185/id/1002901,text/html,application/xhtml+xml,en,"All Listings ( 2694 ) | Greater Niagara Chamber of Commerce Directory  View Listings: ▼ By Category ▼ Alphabetically My Contact List Print List Print my contact list Print Remove All Search ▼ Advanced Search Only PeopleOnly CompaniesAll Legend: Description Available - Additional Images Available - Map Available - All Listings ( 2694 ) 1 2 3 4 5 6 7 8 9 10 11 12 13 14 15 Next > A - Z Z - A 13th Street Winery Phone: (905) 984-8463 Fax: (905) 988-1384 Email: info@13thstreetwinery.com 13th Street Winery evolved from the desire to create exceptional wines that reflect the unique terroir of Niagara while alsoproviding a View Full Listing Similar Listings: Winery / Wineries Contact Listing Owner Please fill in this form to send a message by email to the owner of the listing for 13th Street Winery First Name * Last Name Email * Invalid Email Message Subject * Message *   I understand this service is for personalized messages only and may not be used to send unsolicited broadcast messages to listing owners. Send Message 1729679 Ontario Ltd. O/A Valet Car Wash Phone: (905) 682-2277 Fax: (905) 682-2276 Email: valetcarwash@hotmail.com At St. Catherines Valet Car Wash our Mission isTo be the first choice for vehicle cleaning, appearance and maintenance needs in St. View Full Listing Similar Listings: Car Wash/Gas Bar Contact Listing Owner Please fill in this form to send a message by email to the owner of the listing for 1729679 Ontario Ltd. O/A Valet Car Wash First Name * Last Name Email * Invalid Email Message Subject * Message *   I understand this service is for personalized messages only and may not be used to send unsolicited broadcast messages to listing owners. Send Message 180 Marketing Phone: (905) 687-3371 Fax: (905) 687-9224 Email: luc@do180.com 180 Marketing is a full service agency dedicated to achieving our customers marketing objectives using all forms of media. With a View Full Listing Similar Listings: Marketing - Advertising/Branding/Communications Contact Listing Owner Please fill in this form to send a message by email to the owner of the listing for 180 Marketing First Name * Last Name Email * Invalid Email Message Subject * Message *   I understand this service is for personalized messages only and may not be used to send unsolicited broadcast messages to listing owners. Send Message 20/20 Insurance Brokers Ltd Phone: (905) 984-8694 Email: morgan@2020insurance.ca View Full Listing Similar Listings: Insurance - Broker/Financial Services Contact Listing Owner Please fill in this form to send a message by email to the owner of the listing for 20/20 Insurance Brokers Ltd First Name * Last Name Email * Invalid Email Message Subject * Message *   I understand this service is for personalized messages only and may not be used to send unsolicited broadcast messages to listing owners. Send Message 2021 Canada Games Host Society, Inc. Phone: (905) 321-5979 Email: vittoria@luvvittsolutions.com POWERING UP | NIAGARA 2021The 2021 Canada Games Host Society is the steward tasked with hosting the 28th edition of the Canada Games. To be View Full Listing Similar Listings: Special Events Contact Listing Owner Please fill in this form to send a message by email to the owner of the listing for 2021 Canada Games Host Society, Inc. First Name * Last Name Email * Invalid Email Message Subject * Message *   I understand this service is for personalized messages only and may not be used to send unsolicited broadcast messages to listing owners. Send Message 88 Co. / Brock Office Automation Phone: (905) 984-8266 Email: mgammon@BrockOA.com Business process innovations and improvement consultations. Solutions available from Dahle, Destroyit, Epson/Seiko, Francotyp Postalia, View Full Listing Similar Listings: Professional Services - Business Contact Listing Owner Please fill in this form to send a message by email to the owner of the listing for 88 Co. / Brock Office Automation First Name * Last Name Email * Invalid Email Message Subject * Message *   I understand this service is for personalized messages only and may not be used to send unsolicited broadcast messages to listing owners. Send Message A & M Electric Phone: (905) 468-3834 Email: Angelo@amelectric.ca A & M Electric (A&M Electric) installs and maintains electrical systems in residential, commercial,industrial and institutional View Full Listing Similar Listings: Electrical Contractors Contact Listing Owner Please fill in this form to send a message by email to the owner of the listing for A & M Electric First Name * Last Name Email * Invalid Email Message Subject * Message *   I understand this service is for personalized messages only and may not be used to send unsolicited broadcast messages to listing owners. Send Message A Third Space Pottery Studio Phone: (289) 501-1967 Email: vchartmann@yahoo.ca A Third Space is a warm, bright studio located near the skyway in St. Catharines, Ontario. It is the perfect spot to relax, learn and enjoy View Full Listing Similar Listings: Pottery, Ceramics, Pottery Studios Contact Listing Owner Please fill in this form to send a message by email to the owner of the listing for A Third Space Pottery Studio First Name * Last Name Email * Invalid Email Message Subject * Message *   I understand this service is for personalized messages only and may not be used to send unsolicited broadcast messages to listing owners. Send Message A.S. Security & Surveillance Inc Phone: (289) 568-0660 Email: questions@assecurity.ca A.S. Security & Surveillance Inc is a licenced, insured and WSIB certified Niagara and Hamilton Region based security company View Full Listing Similar Listings: Security Chamber members can get a 5% discount on any new commercial installation from A.S. Security & Surveillance! Contact Rob or Anthony at 289-568-0660 today! Contact Listing Owner Please fill in this form to send a message by email to the owner of the listing for A.S. Security & Surveillance Inc First Name * Last Name Email * Invalid Email Message Subject * Message *   I understand this service is for personalized messages only and may not be used to send unsolicited broadcast messages to listing owners. Send Message A-1 Flooring Canada Phone: (905) 688-9200 Toll Free: (800) 375-9901 Fax: (905) 689-9989 Email: scheduling@a1flooring.com Sales and installation of hardwood, ceramic, vinyl, laminate, and carpet. Retail and commercial. View Full Listing Similar Listings: Retail - Floor Coverings/Treatments Contact Listing Owner Please fill in this form to send a message by email to the owner of the listing for A-1 Flooring Canada First Name * Last Name Email * Invalid Email Message Subject * Message *   I understand this service is for personalized messages only and may not be used to send unsolicited broadcast messages to listing owners. Send Message 1 2 3 4 5 6 7 8 9 10 11 12 13 14 15 Next > A - Z Z - A Directory Sitemap New Members Special Offers Membee | Join The Hive",0.014926046176046183,0.5061908770242104,Positive,Subjective
66433,81534,20200606,memberservices.membee.com,https://memberservices.membee.com/feeds/directory/directory/action/Alpha/value/All/listingType/A/cid/1185/id/1002901,text/html,application/xhtml+xml,en,"All Listings ( 2696 ) | Greater Niagara Chamber of Commerce Directory  View Listings: ▼ By Category ▼ Alphabetically My Contact List Print List Print my contact list Print Remove All Search ▼ Advanced Search Only PeopleOnly CompaniesAll Legend: Description Available - Additional Images Available - Map Available - All Listings ( 2696 ) 1 2 3 4 5 6 7 8 9 10 11 12 13 14 15 Next > A - Z Z - A 13th Street Winery Phone: (905) 984-8463 Fax: (905) 988-1384 Email: info@13thstreetwinery.com 13th Street Winery evolved from the desire to create exceptional wines that reflect the unique terroir of Niagara while alsoproviding a View Full Listing Similar Listings: Winery / Wineries Contact Listing Owner Please fill in this form to send a message by email to the owner of the listing for 13th Street Winery First Name * Last Name Email * Invalid Email Message Subject * Message *   I understand this service is for personalized messages only and may not be used to send unsolicited broadcast messages to listing owners. Send Message 1729679 Ontario Ltd. O/A Valet Car Wash Phone: (905) 682-2277 Fax: (905) 682-2276 Email: valetcarwash@hotmail.com At St. Catherines Valet Car Wash our Mission isTo be the first choice for vehicle cleaning, appearance and maintenance needs in St. View Full Listing Similar Listings: Car Wash/Gas Bar Contact Listing Owner Please fill in this form to send a message by email to the owner of the listing for 1729679 Ontario Ltd. O/A Valet Car Wash First Name * Last Name Email * Invalid Email Message Subject * Message *   I understand this service is for personalized messages only and may not be used to send unsolicited broadcast messages to listing owners. Send Message 180 Marketing Phone: (905) 687-3371 Fax: (905) 687-9224 Email: luc@do180.com 180 Marketing is a full service agency dedicated to achieving our customers marketing objectives using all forms of media. With a View Full Listing Similar Listings: Marketing - Advertising/Branding/Communications Contact Listing Owner Please fill in this form to send a message by email to the owner of the listing for 180 Marketing First Name * Last Name Email * Invalid Email Message Subject * Message *   I understand this service is for personalized messages only and may not be used to send unsolicited broadcast messages to listing owners. Send Message 20/20 Insurance Brokers Ltd Phone: (905) 984-8694 Email: morgan@2020insurance.ca View Full Listing Similar Listings: Insurance - Broker/Financial Services Contact Listing Owner Please fill in this form to send a message by email to the owner of the listing for 20/20 Insurance Brokers Ltd First Name * Last Name Email * Invalid Email Message Subject * Message *   I understand this service is for personalized messages only and may not be used to send unsolicited broadcast messages to listing owners. Send Message 2021 Canada Games Host Society, Inc. Phone: (905) 321-5979 Email: vittoria@luvvittsolutions.com POWERING UP | NIAGARA 2021The 2021 Canada Games Host Society is the steward tasked with hosting the 28th edition of the Canada Games. To be View Full Listing Similar Listings: Special Events Contact Listing Owner Please fill in this form to send a message by email to the owner of the listing for 2021 Canada Games Host Society, Inc. First Name * Last Name Email * Invalid Email Message Subject * Message *   I understand this service is for personalized messages only and may not be used to send unsolicited broadcast messages to listing owners. Send Message 88 Co. / Brock Office Automation Phone: (905) 984-8266 Email: mgammon@BrockOA.com Business process innovations and improvement consultations. Solutions available from Dahle, Destroyit, Epson/Seiko, Francotyp Postalia, View Full Listing Similar Listings: Professional Services - Business Contact Listing Owner Please fill in this form to send a message by email to the owner of the listing for 88 Co. / Brock Office Automation First Name * Last Name Email * Invalid Email Message Subject * Message *   I understand this service is for personalized messages only and may not be used to send unsolicited broadcast messages to listing owners. Send Message A & M Electric Phone: (905) 468-3834 Email: Angelo@amelectric.ca A & M Electric (A&M Electric) installs and maintains electrical systems in residential, commercial,industrial and institutional View Full Listing Similar Listings: Electrical Contractors Contact Listing Owner Please fill in this form to send a message by email to the owner of the listing for A & M Electric First Name * Last Name Email * Invalid Email Message Subject * Message *   I understand this service is for personalized messages only and may not be used to send unsolicited broadcast messages to listing owners. Send Message A Third Space Pottery Studio Phone: (289) 501-1967 Email: vchartmann@yahoo.ca A Third Space is a warm, bright studio located near the skyway in St. Catharines, Ontario. It is the perfect spot to relax, learn and enjoy View Full Listing Similar Listings: Pottery, Ceramics, Pottery Studios Contact Listing Owner Please fill in this form to send a message by email to the owner of the listing for A Third Space Pottery Studio First Name * Last Name Email * Invalid Email Message Subject * Message *   I understand this service is for personalized messages only and may not be used to send unsolicited broadcast messages to listing owners. Send Message A.S. Security & Surveillance Inc Phone: (289) 568-0660 Email: questions@assecurity.ca A.S. Security & Surveillance Inc is a licenced, insured and WSIB certified Niagara and Hamilton Region based security company View Full Listing Similar Listings: Security Chamber members can get a 5% discount on any new commercial installation from A.S. Security & Surveillance! Contact Rob or Anthony at 289-568-0660 today! Contact Listing Owner Please fill in this form to send a message by email to the owner of the listing for A.S. Security & Surveillance Inc First Name * Last Name Email * Invalid Email Message Subject * Message *   I understand this service is for personalized messages only and may not be used to send unsolicited broadcast messages to listing owners. Send Message A-1 Flooring Canada Phone: (905) 688-9200 Toll Free: (800) 375-9901 Fax: (905) 689-9989 Email: scheduling@a1flooring.com Sales and installation of hardwood, ceramic, vinyl, laminate, and carpet. Retail and commercial. View Full Listing Similar Listings: Retail - Floor Coverings/Treatments Contact Listing Owner Please fill in this form to send a message by email to the owner of the listing for A-1 Flooring Canada First Name * Last Name Email * Invalid Email Message Subject * Message *   I understand this service is for personalized messages only and may not be used to send unsolicited broadcast messages to listing owners. Send Message 1 2 3 4 5 6 7 8 9 10 11 12 13 14 15 Next > A - Z Z - A Directory Sitemap New Members Special Offers Membee | Join The Hive",0.014926046176046183,0.5061908770242104,Positive,Subjective
