,index,crawl_date,domain,url,mime_type_web_server,mime_type_tika,language,content,polarity,subjectivity,polarity_type,subjectivity_type
22,23,20200408,travel.gc.ca,https://travel.gc.ca/travelling/health-safety/travel-health-notices,text/html,text/html,en,"Travel health notices Skip to main content Skip to ""About this site"" Language selection Français Government of Canada / Gouvernement du Canada Search Travel.gc.ca Search website Search Menu Main Menu Jobs and the workplace Immigration and citizenship Travel and tourism Business and industry Benefits Health Taxes Environment and natural resources National security and defence Culture, history and sport Policing, justice and emergencies Transport and infrastructure Canada and the world Money and finances Science and innovation You are here: Home Travel Travel abroad Travel health and safety Travel health notices Date Travel health notices Location Level 2019-09-03 Middle East Respiratory Syndrome Coronavirus (MERS-CoV) in Saudi Arabia Saudi Arabia Level 1 2019-01-28 Avian influenza China Level 1 2019-12-24 Zika virus: Advice for travellers American Samoa, Angola, Anguilla, Antigua and Barbuda, Argentina, Aruba, Bahamas, Bangladesh, Barbados, Belize, Bolivia, Bonaire, Brazil, British Virgin Islands, Burkina Faso, Burundi, Cabo Verde, Cambodia, Cameroon, Cayman Islands, Central African Republic, Colombia, Cook Islands, Costa Rica, Côte d'Ivoire, Cuba, Curaçao, Dominica, Dominican Republic, Ecuador, El Salvador, Ethiopia, Fiji, French Guiana, French Polynesia, Gabon, Grenada, Guadeloupe, Guatemala, Guinea-Bissau, Guyana, Haiti, Honduras, India, Indonesia, Jamaica, Laos, Malaysia, Maldives, Marshall Islands, Martinique, Mexico, Micronesia, Montserrat, Myanmar, New Caledonia, Nicaragua, Nigeria, Palau, Panama, Papua New Guinea, Paraguay, Peru, Philippines, Puerto Rico, Saint Barthelemy, Saint Kitts and Nevis, Saint Lucia, Saint Martin, Saint Vincent and the Grenadines, Samoa, Senegal, Singapore, Saint Maarten, Solomon Islands, Suriname, Thailand, Tonga, Trinidad and Tobago, Turks and Caicos, Uganda, United States of America, Vanuatu, Venezuela, Vietnam, Virgin Islands (U.S.) Level 2 2019-10-18 Lassa fever in Nigeria Nigeria Level 1 2019-07-23 Cholera in Yemen Yemen Level 1 2020-02-04 Polio: Advice for travellers Afghanistan, Angola, Benin, Cameroon, Central African Republic, Chad, China, Côte d'Ivoire, Democratic Republic of the Congo, Ethiopia, Ghana, Indonesia, Malaysia, Mozambique, Myanmar, Niger, Nigeria, Pakistan, Papua New Guinea, Philippines, Somalia, Togo, Zambia Level 2 2019-01-22 Diphtheria: Global update Bangladesh, Haiti, Venezuela and Yemen Level 1 2019-10-07 Ebola virus disease in the Democratic Republic of Congo Angola, Burundi, Central African Republic, Democratic Republic of Congo, Republic of Congo (Brazzaville), Rwanda, South Sudan, Tanzania, Uganda, Zambia Level 2 2019-05-10 Rubella in Japan Japan Level 2 2019-10-10 Extensively drug-resistant typhoid in Pakistan Pakistan Level 1 2019-07-23 Global Measles Notice All countries Level 1 2019-10-02 Yellow fever in Nigeria Nigeria Level 1 2020-03-31 Pandemic COVID-19 all countries: avoid non-essential travel outside Canada All Countries Level 3 Levels of risk Conditions in other countries may be different from those in Canada and may affect the health of Canadian travellers. For example: standards of hygiene and sanitation may be different safe food and clean water may be unavailable climate or environmental conditions may support certain diseases that do not (or rarely) occur in Canada The Public Health Agency of Canada (PHAC) actively seeks to identify and evaluate information about new, unusual or rapidly evolving health risks. When necessary, PHAC releases Travel Health Notices outlining the potential risks to Canadian travellers and to the Canadian public, and recommends measures that can be taken to help reduce these risks. Level 1 - Practise usual precautions Travel health notices advise practising usual travel health precautions. For example, notices at this level may remind travellers about routine vaccinations, highlight the importance of hand washing, or recommend protective measures to avoid mosquito bites. Level 2 - Practise special precautions Travel health notices recommend that travellers practise special health precautions, such as receiving additional vaccinations. A notice at this level would be issued if there is an outbreak in a limited geographic location, a newly identified disease in the region or a change in the existing pattern of disease. Level 3 - Avoid non-essential travel Travel health notices include a warning to avoid non-essential travel in order to protect the health of Canadian travellers and the Canadian public. The notice outlines specific precautions to take when visiting the region and what to do if you become ill during or after travel. A notice at this level would be issued during a large-scale outbreak in a large geographic area, or if there is increased risk to the traveller and an increased risk of spreading disease to other groups including the Canadian public. Level 4 - Avoid all travel Advises travellers to avoid all travel in order to protect the health of the Canadian public. A notice at this level would be issued if there is a high risk of spread of disease to the general public regardless of measures taken while travelling. Avoiding travel will limit the spread of the disease in Canada and internationally. Report a problem on this page Please select all that apply: Something is broken Provide more details (optional): The page has spelling or grammar mistakes Provide more details (optional): The information is wrong Provide more details (optional): The information is outdated Provide more details (optional): I can’t find what I’m looking for Describe what you’re looking for (optional): Other Provide more details (optional): Submit Thank you for your help! You will not receive a reply. For enquiries, please contact us. Date modified: 2019-09-04 About government Contact us Departments and agencies Public service and military News Treaties, laws and regulations Government-wide reporting Prime Minister How government works Open government About this site Social media Mobile applications About Canada.ca Terms and conditions Privacy Top of Page",0.05901833460656989,0.35316335625159145,Positive,Objective
2458,2509,20200417,travel.gc.ca,https://travel.gc.ca/travelling/health-safety/travel-health-notices,text/html,text/html,en,"Travel health notices Skip to main content Skip to ""About this site"" Language selection Français Government of Canada / Gouvernement du Canada Search Travel.gc.ca Search website Search Menu Main Menu Jobs and the workplace Immigration and citizenship Travel and tourism Business and industry Benefits Health Taxes Environment and natural resources National security and defence Culture, history and sport Policing, justice and emergencies Transport and infrastructure Canada and the world Money and finances Science and innovation You are here: Home Travel Travel abroad Travel health and safety Travel health notices Date Travel health notices Location Level 2019-09-03 Middle East Respiratory Syndrome Coronavirus (MERS-CoV) in Saudi Arabia Saudi Arabia Level 1 2019-01-28 Avian influenza China Level 1 2019-12-24 Zika virus: Advice for travellers American Samoa, Angola, Anguilla, Antigua and Barbuda, Argentina, Aruba, Bahamas, Bangladesh, Barbados, Belize, Bolivia, Bonaire, Brazil, British Virgin Islands, Burkina Faso, Burundi, Cabo Verde, Cambodia, Cameroon, Cayman Islands, Central African Republic, Colombia, Cook Islands, Costa Rica, Côte d'Ivoire, Cuba, Curaçao, Dominica, Dominican Republic, Ecuador, El Salvador, Ethiopia, Fiji, French Guiana, French Polynesia, Gabon, Grenada, Guadeloupe, Guatemala, Guinea-Bissau, Guyana, Haiti, Honduras, India, Indonesia, Jamaica, Laos, Malaysia, Maldives, Marshall Islands, Martinique, Mexico, Micronesia, Montserrat, Myanmar, New Caledonia, Nicaragua, Nigeria, Palau, Panama, Papua New Guinea, Paraguay, Peru, Philippines, Puerto Rico, Saint Barthelemy, Saint Kitts and Nevis, Saint Lucia, Saint Martin, Saint Vincent and the Grenadines, Samoa, Senegal, Singapore, Saint Maarten, Solomon Islands, Suriname, Thailand, Tonga, Trinidad and Tobago, Turks and Caicos, Uganda, United States of America, Vanuatu, Venezuela, Vietnam, Virgin Islands (U.S.) Level 2 2019-10-18 Lassa fever in Nigeria Nigeria Level 1 2019-07-23 Cholera in Yemen Yemen Level 1 2020-02-04 Polio: Advice for travellers Afghanistan, Angola, Benin, Cameroon, Central African Republic, Chad, China, Côte d'Ivoire, Democratic Republic of the Congo, Ethiopia, Ghana, Indonesia, Malaysia, Mozambique, Myanmar, Niger, Nigeria, Pakistan, Papua New Guinea, Philippines, Somalia, Togo, Zambia Level 2 2019-01-22 Diphtheria: Global update Bangladesh, Haiti, Venezuela and Yemen Level 1 2019-10-07 Ebola virus disease in the Democratic Republic of Congo Angola, Burundi, Central African Republic, Democratic Republic of Congo, Republic of Congo (Brazzaville), Rwanda, South Sudan, Tanzania, Uganda, Zambia Level 2 2019-05-10 Rubella in Japan Japan Level 2 2019-10-10 Extensively drug-resistant typhoid in Pakistan Pakistan Level 1 2019-07-23 Global Measles Notice All countries Level 1 2019-10-02 Yellow fever in Nigeria Nigeria Level 1 2020-04-16 Pandemic COVID-19 all countries: avoid non-essential travel outside Canada All Countries Level 3 Levels of risk Conditions in other countries may be different from those in Canada and may affect the health of Canadian travellers. For example: standards of hygiene and sanitation may be different safe food and clean water may be unavailable climate or environmental conditions may support certain diseases that do not (or rarely) occur in Canada The Public Health Agency of Canada (PHAC) actively seeks to identify and evaluate information about new, unusual or rapidly evolving health risks. When necessary, PHAC releases Travel Health Notices outlining the potential risks to Canadian travellers and to the Canadian public, and recommends measures that can be taken to help reduce these risks. Level 1 - Practise usual precautions Travel health notices advise practising usual travel health precautions. For example, notices at this level may remind travellers about routine vaccinations, highlight the importance of hand washing, or recommend protective measures to avoid mosquito bites. Level 2 - Practise special precautions Travel health notices recommend that travellers practise special health precautions, such as receiving additional vaccinations. A notice at this level would be issued if there is an outbreak in a limited geographic location, a newly identified disease in the region or a change in the existing pattern of disease. Level 3 - Avoid non-essential travel Travel health notices include a warning to avoid non-essential travel in order to protect the health of Canadian travellers and the Canadian public. The notice outlines specific precautions to take when visiting the region and what to do if you become ill during or after travel. A notice at this level would be issued during a large-scale outbreak in a large geographic area, or if there is increased risk to the traveller and an increased risk of spreading disease to other groups including the Canadian public. Level 4 - Avoid all travel Advises travellers to avoid all travel in order to protect the health of the Canadian public. A notice at this level would be issued if there is a high risk of spread of disease to the general public regardless of measures taken while travelling. Avoiding travel will limit the spread of the disease in Canada and internationally. Report a problem on this page Please select all that apply: Something is broken Provide more details (optional): The page has spelling or grammar mistakes Provide more details (optional): The information is wrong Provide more details (optional): The information is outdated Provide more details (optional): I can’t find what I’m looking for Describe what you’re looking for (optional): Other Provide more details (optional): Submit Thank you for your help! You will not receive a reply. For enquiries, please contact us. Date modified: 2019-09-04 About government Contact us Departments and agencies Public service and military News Treaties, laws and regulations Government-wide reporting Prime Minister How government works Open government About this site Social media Mobile applications About Canada.ca Terms and conditions Privacy Top of Page",0.05901833460656989,0.35316335625159145,Positive,Objective
5279,5366,20200417,travel.gc.ca,https://travel.gc.ca/,text/html,text/html,en,"Travel.gc.ca - Home Skip to main content Skip to ""About this site"" Language selection Français Government of Canada / Gouvernement du Canada Search Travel.gc.ca Search website Search Menu Main Menu Jobs and the workplace Immigration and citizenship Travel and tourism Business and industry Benefits Health Taxes Environment and natural resources National security and defence Culture, history and sport Policing, justice and emergencies Transport and infrastructure Canada and the world Money and finances Science and innovation You are here: Home Travel and tourism Information on how to have a safe and enjoyable journey whether you are travelling in Canada or abroad. Follow: Twitter Facebook Instagram Promotions COVID-19: Your safety and security outside Canada Coronavirus disease (COVID-19): Travel advice Register as a Canadian abroad Coronavirus disease (COVID-19) An official global travel advisory is in effect: Avoid non-essential travel outside Canada until further notice. Check the Pandemic COVID-19 travel health notice. Check our Travel Advice and Advisories for more information. Check our COVID-19 safety and security advice for Canadians abroad. If you need financial help to return to Canada, check COVID-19: Financial help for Canadians outside Canada. Avoid all cruise ship travel due to COVID-19. Most requested Consular services and assistance for Canadians in China Travel Advice and Advisories Recommended consent letter for children travelling abroad Canada - U.S. border wait times Register as a Canadian abroad Apply for NEXUS What you can bring home to Canada Contact an embassy or consulate Cannabis and international travel Services and information Travel Advice and Advisories Official Government of Canada travel information Where do you want to go? Select a destination Afghanistan Albania Algeria American Samoa Andorra Angola Anguilla Antarctica Antigua and Barbuda Argentina Armenia Aruba Australia Austria Azerbaijan Azores Bahamas Bahrain Bangladesh Barbados Belarus Belgium Belize Benin Bermuda Bhutan Bolivia Bonaire Bosnia and Herzegovina Botswana Brazil British Virgin Islands Brunei Bulgaria Burkina Faso Burundi Cabo Verde Cambodia Cameroon Canary Islands Cayman Islands Central African Republic Chad Chile China Colombia Comoros Cook Islands Costa Rica Côte d'Ivoire (Ivory Coast) Croatia Cuba Curaçao Cyprus Czech Republic Democratic Republic of Congo (Kinshasa) Denmark Djibouti Dominica Dominican Republic Ecuador Egypt El Salvador Equatorial Guinea Eritrea Estonia Eswatini Ethiopia Falkland Islands Fiji Finland France French Guiana French Polynesia Gabon Gambia, The Georgia Germany Ghana Gibraltar Greece Greenland Grenada Guadeloupe Guam Guatemala Guinea Guinea-Bissau Guyana Haiti Honduras Hong Kong Hungary Iceland India Indonesia Iran Iraq Ireland Israel, the West Bank and the Gaza Strip Italy Jamaica Japan Jordan Kazakhstan Kenya Kiribati Kosovo Kuwait Kyrgyzstan Laos Latvia Lebanon Lesotho Liberia Libya Liechtenstein Lithuania Luxembourg Macao Madagascar Malawi Malaysia Maldives Mali Malta Marshall Islands Martinique Mauritania Mauritius Mayotte Mexico Micronesia (FSM) Moldova Monaco Mongolia Montenegro Montserrat Morocco Mozambique Myanmar Namibia Nauru Nepal Netherlands New Caledonia New Zealand Nicaragua Niger Nigeria Niue North Korea North Macedonia Northern Marianas Norway Oman Pakistan Palau Panama Papua New Guinea Paraguay Peru Philippines Poland Portugal Puerto Rico Qatar Republic of Congo (Brazzaville) Réunion Romania Russia Rwanda Saint-Barthélemy Saint Kitts and Nevis Saint Lucia Saint Martin Saint-Pierre-et-Miquelon Saint Vincent & the Grenadines Samoa San Marino Sao Tome and Principe Saudi Arabia Senegal Serbia Seychelles Sierra Leone Singapore Sint Maarten Slovakia Slovenia Solomon Islands Somalia South Africa South Korea South Sudan Spain Sri Lanka Sudan Suriname Sweden Switzerland Syria Taiwan Tajikistan Tanzania Thailand Timor-Leste (East Timor) Togo Tokelau Tonga Trinidad and Tobago Tunisia Turkey Turkmenistan Turks and Caicos Islands Tuvalu Uganda Ukraine United Arab Emirates United Kingdom United States Uruguay Uzbekistan Vanuatu Venezuela Vietnam Virgin Islands (U.S.) Yemen Zambia Zimbabwe Go! Canadian attractions, events and experiences Free admission for youth 17 and under to Canada's national parks and historic sites! Discover Canada's museums and enjoy unforgettable experiences. Canadian passports Everything you need to know to apply for, renew or replace a lost passport Travel abroad Information on travel health and safety, air travel, border wait times and more Air travel Everything you need to know to prepare for a worry-free flight Return to Canada Information on travelling to Canada, border wait times, customs and immigration Assistance abroad How to get help if there is an emergency when you are travelling abroad Visit Canada Find out if you need a visa to visit or transit through Canada, and how to extend your stay as a visitor Stay connected Keep in touch with Canada wherever you are through our smart travel tools Ask travel Travelling and need answers? Try our interactive tool What we are doing Policies, acts and regulations Citizenship Act Department of Foreign Affairs, Trade and Development Act Public Health Agency of Canada Act Canada Border Services Agency Act Publications Bon Voyage, But... Essential Information for Canadian Travellers Her Own Way - A Woman's Safe-Travel Guide Travelling with Children Traveller’s checklist All related publications Forms CATSA claims forms Recommended consent letter for children travelling abroad Registration of Canadians Abroad US to Canada border wait times A regularly updated list of wait times at border ports of entry for drivers coming to Canada from the U.S. Dual Canadian citizens: Fly to Canada with a valid CDN passport You need a valid Canadian passport to board a flight to Canada. What you can bring back to Canada General guidelines on what you can and cannot bring into Canada when you return from abroad. Report a problem on this page Please select all that apply: Something is broken Provide more details (optional): The page has spelling or grammar mistakes Provide more details (optional): The information is wrong Provide more details (optional): The information is outdated Provide more details (optional): I can’t find what I’m looking for Describe what you’re looking for (optional): Other Provide more details (optional): Submit Thank you for your help! You will not receive a reply. For enquiries, please contact us. Date modified: 2020-03-26 About government Contact us Departments and agencies Public service and military News Treaties, laws and regulations Government-wide reporting Prime Minister How government works Open government About this site Social media Mobile applications About Canada.ca Terms and conditions Privacy Top of Page",0.14859507776174444,0.34552623302623303,Positive,Objective
